{
  "version": 2,
  "name": "Quick Reply Set Name",
  "disableSend": false,
  "placeBeforeInput": false,
  "injectInput": false,
  "color": "rgba(0, 0, 0, 0)",
  "onlyBorderColor": false,
  "qrList": [
    {
      "id": 1,
      "showLabel": false,
      "label": "Button Label",
      "title": "",
      "message": "/command-or-text",
      "contextList": [],
      "preventAutoExecute": true,
      "isHidden": false,
      "executeOnStartup": false,
      "executeOnUser": false,
      "executeOnAi": false,
      "executeOnChatChange": false,
      "executeOnGroupMemberDraft": false,
      "executeOnNewChat": false,
      "executeBeforeGeneration": false,
      "automationId": ""
    }
  ],
  "idIndex": 1
}
